{
  "schema_version": "2.0",
  "namespace": "sastbench.public",
  "pack_id": "pilot-2026-09",
  "version": "0.1.0-draft",
  "status": "draft",
  "description": "First real-case pilot: three repositories, three languages, three mechanisms. Draft labels only; no independent review has been recorded.",
  "review_budgets": {
    "full": [
      5,
      10,
      20,
      50
    ],
    "pr": [
      5,
      10,
      20
    ]
  },
  "snapshots": [
    {
      "tree_hash": "sha256:aab29bfad6368fa4f4f5e5fa5724cc37aaba6e46b80062032df74e2d8d6c1426",
      "git_tree": null,
      "role": "vulnerable",
      "snapshot_id": "oauth2-proxy-f4b33b64",
      "repository": {
        "url": "https://github.com/oauth2-proxy/oauth2-proxy.git",
        "name": "oauth2-proxy/oauth2-proxy"
      },
      "commit": "f4b33b64bd66ad28e9b0d63bea51837b83c00ca1",
      "reference": "parent of fix commit 9ffafad4b2d2f9f7668e5504565f356a7c047b77 (verified 2026-09-20 via git); last state before v7.11.0 repair",
      "languages": [
        "go"
      ],
      "workload": "conventional_application",
      "component_role": "infrastructure",
      "production_use_evidence": "Widely deployed authentication reverse proxy; project docs describe production deployments.",
      "license": {
        "spdx": "MIT",
        "verified": false,
        "note": "Repository LICENSE reported as MIT; not yet verified for the exact snapshot and paths."
      }
    },
    {
      "tree_hash": "sha256:a6a93cb57b8e3171bd0c6190b73515eeecfd7ce571cff0593df175a3e94ba713",
      "git_tree": null,
      "role": "vulnerable",
      "snapshot_id": "fastmcp-c861862a",
      "repository": {
        "url": "https://github.com/PrefectHQ/fastmcp.git",
        "name": "PrefectHQ/fastmcp"
      },
      "commit": "c861862aededc7294cea5634d77e6926444ca101",
      "reference": "parent of fix commit 40bdfb6b1de0ce30609ee9ba5bb95ecd04a9fb71 (PR #3507, committed 2026-03-15; verified 2026-09-20 via git)",
      "languages": [
        "python"
      ],
      "workload": "agentic_application",
      "component_role": "library_sdk",
      "production_use_evidence": "MCP server framework used by downstream agent deployments; vendor docs only.",
      "license": {
        "spdx": "Apache-2.0",
        "verified": false,
        "note": "Reported Apache-2.0; not yet verified for the exact snapshot and paths."
      }
    },
    {
      "tree_hash": "sha256:a3554a9499f76544d02d706b0df69c2220da3aff2b66e77a5a744486b047a9e7",
      "git_tree": null,
      "role": "vulnerable",
      "snapshot_id": "fastify-v5.12.1",
      "repository": {
        "url": "https://github.com/fastify/fastify.git",
        "name": "fastify/fastify"
      },
      "commit": "7d196a998c422062a3aaa3f8041db91ad576cea0",
      "reference": "tag v5.12.1 (7d196a99), the last release in the advisory's affected range >=4.0.0,<5.12.2; the named fix commit d66ebd12 landed on main (6.0.0-alpha line) and its backport into v5.12.2 (tag 942a2be8) is not yet verified",
      "languages": [
        "javascript"
      ],
      "workload": "conventional_application",
      "component_role": "library_sdk",
      "production_use_evidence": "Node.js HTTP framework with production documentation.",
      "license": {
        "spdx": "MIT",
        "verified": false,
        "note": "Reported MIT; not yet verified for the exact snapshot and paths."
      }
    }
  ],
  "cases": [
    {
      "case_id": "oauth2-proxy-cve-2025-54576",
      "represents": "This case tests path-versus-full-URI confusion in regex-based skip_auth_routes matching at an authentication proxy boundary under the assumption that a configured skip regex can match attacker-controlled query text and the upstream tolerates that query, and adds a justified replication of legacy case SB-GO-RG-001 so the v2 pipeline is exercised on a Go target whose vulnerable commit, regions, and fix anchors were already mapped.",
      "workload": "conventional_application",
      "component_role": "infrastructure",
      "model_involvement": {
        "state": "not_applicable",
        "reason": "No model participates in the mechanism."
      },
      "coverage_signature": {
        "idiom": "Go net/http reverse proxy with operator-configured regex allowlists",
        "input_source": "HTTP request target and X-Forwarded-Uri header",
        "trust_boundary": "unauthenticated client to authentication gate",
        "security_operation": "authentication skip decision",
        "guard_failure": "allowlist regex evaluated against path plus query instead of path only",
        "analysis_span": "two functions across two files (util.go GetRequestURI, oauthproxy.go isAllowedPath)"
      },
      "canonical_target": {
        "kind": "auth_bypass",
        "variant_family": "oauth2-proxy-cve-2025-54576",
        "aliases": [
          "CVE-2025-54576",
          "GHSA-7rh7-c77v-6434"
        ]
      },
      "target": {
        "target_id": "T-oauth2-proxy-cve-2025-54576",
        "snapshot_id": "oauth2-proxy-f4b33b64",
        "kind": "auth_bypass",
        "description": "GetRequestURI returns the full request URI including the query string, and isAllowedPath matches the configured skip_auth_routes regex against that full URI. An attacker can append crafted query parameters to a protected path so the regex still matches a public allowlist entry, letting unauthenticated requests reach protected backends.",
        "affected_input_or_authority": "Query string appended by an unauthenticated client to a protected path",
        "accepted_locations": [
          {
            "path": "pkg/requests/util/util.go",
            "role": "other",
            "note": "legacy region R1 label=vulnerable capability=authentication",
            "start_line": 37,
            "end_line": 44
          },
          {
            "path": "oauthproxy.go",
            "role": "other",
            "note": "legacy region R2 label=vulnerable capability=authentication",
            "start_line": 582,
            "end_line": 590
          }
        ],
        "assumptions": [
          "A skip_auth_routes regex is configured that attacker-controlled query text can satisfy.",
          "The upstream tolerates the appended query."
        ],
        "matching_rules": [
          "Accept an allegation that the skip-auth path match is evaluated on the full request URI including the query, at either the URI extraction (util.go) or the match site (oauthproxy.go).",
          "Reject generic 'regex allowlist bypass' claims that do not identify query inclusion as the failure."
        ]
      },
      "controls": [],
      "evidence": [
        {
          "evidence_id": "legacy-record",
          "origin": "legacy_case_record",
          "kind": "other",
          "reference": "cases/full/real_world_generic/SB-GO-RG-001/case.json",
          "note": "Legacy case SB-GO-RG-001 (real_world_generic); prior draft regions, not v2-reviewed labels."
        },
        {
          "evidence_id": "fix-commit",
          "origin": "public_advisory_and_maintainer_fix",
          "kind": "fix_commit",
          "reference": "oauth2-proxy/oauth2-proxy@9ffafad4b2d2f9f7668e5504565f356a7c047b77",
          "note": "Fix commit named by the legacy record."
        },
        {
          "evidence_id": "ghsa",
          "origin": "public_advisory_and_maintainer_fix",
          "kind": "ghsa_advisory",
          "reference": "https://github.com/advisories/GHSA-7rh7-c77v-6434",
          "note": ""
        },
        {
          "evidence_id": "cve",
          "origin": "public_advisory_and_maintainer_fix",
          "kind": "cve_record",
          "reference": "https://www.cve.org/CVERecord?id=CVE-2025-54576",
          "note": ""
        },
        {
          "evidence_id": "fix-parent-check",
          "origin": "research_note",
          "kind": "source_inspection",
          "reference": "git: 9ffafad4b2d2f9f7668e5504565f356a7c047b77^ == f4b33b64bd66ad28e9b0d63bea51837b83c00ca1",
          "note": "Verified 2026-09-20 with a shallow fetch; the pinned vulnerable snapshot is the direct parent of the fix.",
          "retrieved": "2026-09-20"
        },
        {
          "evidence_id": "fix-hunks",
          "origin": "public_advisory_and_maintainer_fix",
          "kind": "source_inspection",
          "reference": "git diff 9ffafad4^..9ffafad4 -- oauthproxy.go pkg/requests/util/util.go",
          "note": "Verified 2026-09-20: oauthproxy.go line 583 changes route.pathRegex.MatchString(requestutil.GetRequestURI(req)) to GetRequestPath(req), and util.go gains GetRequestPath, which parses the URI and returns only its path component. Both repaired sites fall inside the accepted locations carried over from the legacy record, and the diff confirms the root cause is the full-URI match rather than the regex itself.",
          "retrieved": "2026-09-20"
        }
      ],
      "disclosure": {
        "earliest_public_artifact": "2025-07-30",
        "cve_published": null,
        "ghsa_published": "2025-07-30",
        "fix_commit_date": "2025-07-30",
        "note": "GHSA-7rh7-c77v-6434 published 2025-07-30; fix commit 9ffafad4 committed 2025-07-30 (git). Earliest artifact assumed equal to the GHSA date pending a search of earlier public references."
      },
      "disposition": {
        "value": "needs_evidence",
        "reason": "Migrated from a legacy v1 record: mapped regions are prior draft evidence and need v2 review."
      },
      "validation": {
        "level": "L1",
        "review_state": "mechanically_checked",
        "checks": [
          {
            "check": "locations_exist_in_snapshot",
            "result": "pass",
            "at": "2026-09-20T08:37:12+00:00",
            "detail": "2 locations found",
            "snapshot_id": "oauth2-proxy-f4b33b64"
          },
          {
            "check": "line_ranges_within_files",
            "result": "pass",
            "at": "2026-09-20T08:37:12+00:00",